<?xml version="1.1" encoding="UTF-8"?>
<!--
  The command permission format: what autoallow reads to answer a PreToolUse
  call about a Bash command.

  A <rule> matches the command as written, or the resolved process name when
  it carries command=. The section it sits in gives it its meaning, so an
  identical node denies under <deny> and allows under <allow>. A rule nests
  its subcommands as further <rule> children.

  This is a different job from the prose format in rules/, and a different
  shape: <test> here drives a command through the hook rather than driving a
  rewrite over English.
-->
<xs:schema xmlns:xs="http://www.w3.org/2001/XMLSchema" elementFormDefault="qualified">

  <!-- One command, and the verdict the hook must return for it. An empty
       expect= means the hook answers nothing and the caller decides. -->
  <xs:complexType name="test">
    <xs:attribute name="cmd" type="xs:string" use="required"/>
    <xs:attribute name="expect" type="xs:string" use="required"/>
  </xs:complexType>

  <xs:complexType name="flagList">
    <xs:sequence>
      <xs:element name="flag" minOccurs="0" maxOccurs="unbounded">
        <xs:complexType>
          <xs:attribute name="name" type="xs:string" use="required"/>
        </xs:complexType>
      </xs:element>
    </xs:sequence>
  </xs:complexType>

  <xs:complexType name="stringList">
    <xs:sequence>
      <xs:element name="value" type="xs:string" maxOccurs="unbounded"/>
    </xs:sequence>
  </xs:complexType>

  <!-- Refuses the command outright, where denyArgSubstrings only unmatches
       the rule. Every kind of child given must match, and any one of a kind is
       enough. message= is what the caller is told instead. -->
  <xs:complexType name="refuse">
    <xs:sequence>
      <xs:element name="flag" minOccurs="0" maxOccurs="unbounded">
        <xs:complexType>
          <xs:attribute name="name" type="xs:string" use="required"/>
        </xs:complexType>
      </xs:element>
      <xs:element name="flagValue" minOccurs="0">
        <xs:complexType>
          <xs:sequence>
            <xs:element name="flag" maxOccurs="unbounded">
              <xs:complexType>
                <xs:attribute name="name" type="xs:string" use="required"/>
              </xs:complexType>
            </xs:element>
            <xs:element name="value" type="xs:string" maxOccurs="unbounded"/>
          </xs:sequence>
        </xs:complexType>
      </xs:element>
      <xs:element name="argPrefix" type="xs:string" minOccurs="0" maxOccurs="unbounded"/>
      <xs:element name="argSubstring" type="xs:string" minOccurs="0" maxOccurs="unbounded"/>
    </xs:sequence>
    <xs:attribute name="message" type="xs:string" use="required"/>
  </xs:complexType>

  <!-- A flag whose VALUE decides the verdict, with the value assumed when the
       flag is absent. -->
  <xs:complexType name="requireFlagValue">
    <xs:sequence>
      <xs:element name="flag" minOccurs="0" maxOccurs="unbounded">
        <xs:complexType>
          <xs:attribute name="name" type="xs:string" use="required"/>
        </xs:complexType>
      </xs:element>
      <xs:element name="allowed" type="xs:string" minOccurs="0" maxOccurs="unbounded"/>
    </xs:sequence>
    <xs:attribute name="default" type="xs:string"/>
  </xs:complexType>

  <xs:complexType name="rule">
    <xs:choice minOccurs="0" maxOccurs="unbounded">
      <xs:element name="test" type="test"/>
      <xs:element name="allowedFlags" type="flagList"/>
      <xs:element name="deniedFlags" type="flagList"/>
      <xs:element name="execFlags" type="flagList"/>
      <xs:element name="requiredFlags" type="flagList"/>
      <xs:element name="flagsWithValue" type="flagList"/>
      <xs:element name="denyArgSubstrings" type="stringList"/>
      <xs:element name="refuse" type="refuse"/>
      <xs:element name="allowedArgPrefixes" type="stringList"/>
      <xs:element name="requireFlagValue" type="requireFlagValue"/>
      <xs:element name="rule" type="rule"/>
    </xs:choice>
    <!-- name= is the word as typed, and takes a comma-separated list of
         spellings that mean the same command. -->
    <xs:attribute name="name" type="xs:string"/>
    <xs:attribute name="description" type="xs:string"/>
    <!-- command= matches the RESOLVED process instead: basename, wrappers
         stripped, version ignored. -->
    <xs:attribute name="command" type="xs:string"/>
    <xs:attribute name="inlineScript" type="xs:boolean"/>
    <xs:attribute name="evalFlags" type="xs:string"/>
    <xs:attribute name="evalSubcommands" type="xs:string"/>
    <xs:attribute name="message" type="xs:string"/>
    <!-- The "*" spelling, for a command whose flags are all acceptable. -->
    <xs:attribute name="allowedFlags" type="xs:string"/>
    <xs:attribute name="denyWithMessage" type="xs:string"/>
    <xs:attribute name="helpAlwaysAllowed" type="xs:boolean"/>
    <xs:attribute name="bareOnly" type="xs:boolean"/>
  </xs:complexType>

  <xs:complexType name="section">
    <xs:sequence>
      <xs:element name="rule" type="rule" minOccurs="0" maxOccurs="unbounded"/>
    </xs:sequence>
  </xs:complexType>

  <xs:element name="rules">
    <xs:complexType>
      <xs:choice minOccurs="0" maxOccurs="unbounded">
        <xs:element name="test" type="test"/>
        <xs:element name="allow" type="section"/>
        <xs:element name="ask" type="section"/>
        <xs:element name="deny" type="section"/>
        <!-- A tree refused to every tool that reaches it. The text is what
             the caller is told, and prefix= is where the refusal starts. -->
        <xs:element name="denyPath">
          <xs:complexType>
            <xs:simpleContent>
              <xs:extension base="xs:string">
                <xs:attribute name="prefix" type="xs:string" use="required"/>
              </xs:extension>
            </xs:simpleContent>
          </xs:complexType>
        </xs:element>

        <xs:element name="mcpServer">
          <xs:complexType>
            <xs:sequence>
              <xs:element name="tool" type="xs:string" minOccurs="0" maxOccurs="unbounded"/>
            </xs:sequence>
            <xs:attribute name="name" type="xs:string" use="required"/>
          </xs:complexType>
        </xs:element>
      </xs:choice>
      <xs:attribute name="case" type="case" use="required"/>
    </xs:complexType>
  </xs:element>

  <!-- Commands, flags and paths are read as typed, so the root says
       sensitive and the loader refuses a table that does not. -->
  <xs:simpleType name="case">
    <xs:restriction base="xs:string">
      <xs:enumeration value="sensitive"/>
    </xs:restriction>
  </xs:simpleType>

</xs:schema>
