<?xml version="1.1" encoding="UTF-8"?>
<rules xmlns:xsi="http://www.w3.org/2001/XMLSchema-instance" xsi:noNamespaceSchemaLocation="rules.xsd" case="sensitive">
	<!-- Cross-cutting tests: compounds, redirects, pipes, passthrough -->
	<test cmd="git status &amp;&amp; git diff" expect="allow"/>
	<test cmd="git status &amp;&amp; python --version" expect="deny"/>
	<test cmd="git status || git diff" expect="allow"/>
	<test cmd="git fetch origin latest &amp;&amp; git show HEAD" expect="allow"/>
	<test cmd="ls &amp;&amp; cat file.txt" expect="allow"/>
	<test cmd="git status &amp;&amp; gh run view 123" expect="deny"/>
	<test cmd="git status &amp;&amp; git diff &amp;&amp; git log" expect="allow"/>
	<test cmd="git status; git diff" expect="allow"/>
	<test cmd="cd some/folder &amp;&amp; git diff Config/DefaultEngine.ini" expect="allow"/>
	<test cmd="git log $(echo test)" expect=""/>
	<test cmd="git log | python" expect="deny"/>
	<test cmd="echo foo > file.txt" expect=""/>
	<test cmd="echo foo >> file.txt" expect=""/>
	<test cmd="sort input.txt > output.txt" expect=""/>
	<test cmd="ls > /tmp/out.txt" expect="allow"/>
	<test cmd="ls >> /tmp/out.txt" expect="allow"/>
	<test cmd="ls > /dev/null" expect="allow"/>
	<test cmd="ls > /tmp/sub/out.txt" expect="allow"/>
	<test cmd="ls 2> /tmp/err.txt" expect="allow"/>
	<test cmd="ls &amp;> /tmp/out.txt" expect="allow"/>
	<test cmd="ls &amp;>> /tmp/out.txt" expect="allow"/>
	<test cmd="ls > /etc/foo.txt" expect=""/>
	<test cmd="ls > out.txt" expect=""/>
	<test cmd="ls > /tmp/../etc/passwd" expect=""/>
	<test cmd='gh api --hostname github.com -H "Accept: application/vnd.github.raw+json" "repos/hagezi/dns-blocklists/contents/wildcard/pro.mini-onlydomains.txt" 2>/dev/null > /tmp/hagezi.txt &amp;&amp; wc -l /tmp/hagezi.txt' expect="allow"/>
	<test cmd="echo hello | grep hello" expect="allow"/>
	<test cmd="git log | head" expect="allow"/>
	<test cmd='git show 54d7aa918a94 --stat &amp;&amp; echo "---" &amp;&amp; git show 54d7aa918a94 -- path/to/file.cpp' expect="allow"/>

	<!-- Denied processes, in every spelling the enumeration approach misses. -->
	<test cmd="until ! pgrep -f make.bash; do sleep 15; done" expect="deny"/>
	<test cmd="git status &amp;&amp; until false; do sleep 1; done" expect="deny"/>
	<test cmd="while true; do sleep 1; done" expect="deny"/>
	<test cmd="true" expect="deny"/>
	<test cmd="go build ./... || true" expect="deny"/>
	<test cmd="grep -rn until docs/" expect="allow"/>
	<test cmd="python --version" expect="deny"/>
	<test cmd="python3 script.py" expect="deny"/>
	<test cmd="python3.11 -c 'print(1)'" expect="deny"/>
	<test cmd="/usr/bin/python3 script.py" expect="deny"/>
	<test cmd="env python3 script.py" expect="deny"/>
	<test cmd="env FOO=1 python3 script.py" expect="deny"/>
	<test cmd="PYTHONPATH=/x python3 script.py" expect="deny"/>
	<test cmd="sudo -E python3 script.py" expect="deny"/>
	<test cmd="uv run python script.py" expect="deny"/>
	<!-- A wrapper's VALUE stood where the program should be until shellwalk was shared: these resolved to `10` and `5`, not python. -->
	<test cmd="nice -n 10 python3 script.py" expect="deny"/>
	<test cmd="timeout 5 python3 script.py" expect="deny"/>
	<test cmd="timeout -k 1 5 python3 script.py" expect="deny"/>
	<test cmd="xargs -n 1 python3 script.py" expect="deny"/>
	<test cmd="git status &amp;&amp; python3 script.py" expect="deny"/>
	<test cmd="git log | python3 -" expect="deny"/>
	<test cmd="echo $(python3 -c 'print(1)')" expect="deny"/>
	<test cmd="for f in *.txt; do python3 x.py; done" expect="deny"/>
	<test cmd="python3 - &lt;&lt;'PY'&#10;print(1)&#10;PY" expect="deny"/>
	<test cmd="cat pythonic.txt" expect="allow"/>
	<test cmd="ls /usr/bin/python3" expect="allow"/>

	<!-- Inline scripts are denied; the same interpreter running a FILE is not. -->
	<test cmd="node -e 'console.log(1)'" expect="deny"/>
	<test cmd="node --eval 'console.log(1)'" expect="deny"/>
	<test cmd="node -p '1+1'" expect="deny"/>
	<test cmd="/usr/local/bin/node -e '1'" expect="deny"/>
	<test cmd="echo 'console.log(1)' | node" expect="deny"/>
	<test cmd="node - &lt; script.js" expect="deny"/>
	<test cmd="ruby -e 'puts 1'" expect="deny"/>
	<test cmd="perl -e 'print 1'" expect="deny"/>
	<test cmd="perl -pe 's/a/b/' file.txt" expect="deny"/>
	<test cmd="perl -lane 'print $F[0]' file.txt" expect="deny"/>
	<test cmd="php -r 'echo 1;'" expect="deny"/>
	<test cmd="deno eval 'console.log(1)'" expect="deny"/>
	<test cmd="bun -e 'console.log(1)'" expect="deny"/>
	<test cmd="node script.js" expect=""/>
	<!-- Feeding a NAMED script its input is not handing node a program: the
	     program is script.js, right there in the command text. This is how a hook
	     gets tested with the payload it will really receive. -->
	<test cmd="printf '{&quot;a&quot;:1}' | node hook.ts" expect=""/>
	<test cmd="node hook.ts &lt; payload.json" expect=""/>
	<test cmd="node --experimental-strip-types tool.ts" expect=""/>
	<test cmd="node /home/user/.claude/setup/claude-md-budget.ts" expect=""/>
	<test cmd="ruby script.rb" expect=""/>
	<test cmd="perl script.pl" expect=""/>

	<!-- Programs that may not run, and programs that may not be handed a script.
	     Matched by resolved PROCESS NAME, so one entry covers every spelling:
	     an absolute path, an env/sudo/uv-run wrapper, a version suffix. Deny is
	     evaluated over the whole parse tree, including the constructs the allow
	     path refuses to read (command substitution, subshells, redirects):
	     otherwise a denied program would be one `$(...)` away from running. -->
	<deny>
		<rule command="python"
			message="Python is not available here. Use jq for JSON and node for scripts."/>

		<!-- The harness re-invokes the session when a background command exits.
		     A shell that waits for it holds the turn open, so the wake-up lands
		     on a blocked turn and the session deadlocks until a human ends it. -->
		<rule command="until"
			message="Do not wait in the shell. End the turn and read the output when the command reports, or use gh wait-ci for CI."/>

		<!-- A command that does nothing and reports success. It exists to make a
		     tool call, a chain or a pipeline look like work. -->
		<rule command="true"
			message="This command does nothing. Run the real one, or say what is blocking."/>
		<rule command="false"
			message="This command does nothing. Run the real one, or say what is blocking."/>
		<rule command=":"
			message="This command does nothing. Run the real one, or say what is blocking."/>

		<!-- node, ruby and perl themselves stay usable; this environment's own
		     hooks are `node file.ts`. What is denied is handing them a script:
		     writing a multi-page program into a shell argument, running it, then
		     rewriting the whole thing to change one line, costs more tokens than
		     the task and leaves nothing reviewable behind. Put it in a file. -->
		<rule command="node" inlineScript="true" evalFlags="-e,--eval,-p,--print"
			message="Write the script to a file and run it, or use an Edit/Write tool. Inline -e/--eval programs are unreviewable and get rewritten wholesale on every tweak."/>
		<rule command="ruby" inlineScript="true" evalFlags="-e"
			message="Write the script to a file and run it, or use an Edit/Write tool."/>
		<rule command="perl" inlineScript="true" evalFlags="-e,-E"
			message="Write the script to a file and run it, or use an Edit/Write tool."/>
		<rule command="php" inlineScript="true" evalFlags="-r"
			message="Write the script to a file and run it, or use an Edit/Write tool."/>
		<rule command="deno" inlineScript="true" evalFlags="-e,--eval" evalSubcommands="eval"
			message="Write the script to a file and run it, or use an Edit/Write tool."/>
		<rule command="bun" inlineScript="true" evalFlags="-e,--eval"
			message="Write the script to a file and run it, or use an Edit/Write tool."/>
		<rule command="tsx" inlineScript="true" evalFlags="-e,--eval"
			message="Write the script to a file and run it, or use an Edit/Write tool."/>
		<rule command="ts-node" inlineScript="true" evalFlags="-e,--eval"
			message="Write the script to a file and run it, or use an Edit/Write tool."/>
		<rule command="lua" inlineScript="true" evalFlags="-e"
			message="Write the script to a file and run it, or use an Edit/Write tool."/>
		<rule command="Rscript" inlineScript="true" evalFlags="-e"
			message="Write the script to a file and run it, or use an Edit/Write tool."/>
		<rule command="osascript" inlineScript="true" evalFlags="-e"
			message="Write the script to a file and run it, or use an Edit/Write tool."/>

		<!-- Deleting a branch is the user's call, local or remote, in every
		     spelling: a delete flag, an empty source refspec, a prune, a ref
		     update, and the REST and GraphQL calls behind them. -->
		<rule name="git">
			<test cmd="git push origin --delete feature" expect="deny"/>
			<test cmd="git push --delete origin feature" expect="deny"/>
			<test cmd="git push -d origin feature" expect="deny"/>
			<test cmd="git push -fd origin feature" expect="deny"/>
			<test cmd="git push origin :feature" expect="deny"/>
			<test cmd="git push origin +:refs/heads/feature" expect="deny"/>
			<test cmd="git push --prune origin" expect="deny"/>
			<test cmd="git push --mirror origin" expect="deny"/>
			<test cmd="git -C /repo push origin --delete feature" expect="deny"/>
			<test cmd="git -c push.default=current -C /repo push origin --delete feature" expect="deny"/>
			<test cmd="cd /repo &amp;&amp; git push origin --delete feature" expect="deny"/>
			<test cmd="git push origin bf92470:refs/heads/feature" expect=""/>
			<test cmd="git push -u origin feature" expect=""/>
			<test cmd="git push --force-with-lease origin feature" expect=""/>
			<test cmd="git push --dry-run origin main" expect="allow"/>
			<test cmd="git branch -d feature" expect="deny"/>
			<test cmd="git branch -D feature" expect="deny"/>
			<test cmd="git branch --delete feature" expect="deny"/>